Experiment;PPID;EXP_COND;Questionnaire;QuestionType;Question;QuestionID;Answer
XXXXXX;YYYYYY;ZZZZZ;NASATLX;linearGrid;Mental Demand:				How mentally demanding was the task?;g1;17
XXXXXX;YYYYYY;ZZZZZ;NASATLX;linearGrid;Physical Demand:				How physically demanding was the task?;g2;15
XXXXXX;YYYYYY;ZZZZZ;NASATLX;linearGrid;Temporal Demand:		How hurried or rushed was the pace of the task?;g3;18
XXXXXX;YYYYYY;ZZZZZ;NASATLX;linearGrid;Performance:  How succesfull were you in accomplishing what you were asked to do?;g4;17
XXXXXX;YYYYYY;ZZZZZ;NASATLX;linearGrid;Effort:  How hard did you have to work to accomplish your level of performance?;g5;19
XXXXXX;YYYYYY;ZZZZZ;NASATLX;linearGrid;Frustration:  How insecure, discouraged, irritated, stressed, and annoyed were you?;g6;14